scripts/gemm_config_v100.in
batch_size, seq_len, head_num, size_per_head dataType ### batchCount, n, m, k, algoId, customOption, tile, numSplitsK, swizzle, reductionScheme, workspaceSize, stages, inner_shapeId, cluster_shapeId, exec_time
1 1 40 128 1 ### 1 15360 1 5120 113 -1 -1 -1 -1 -1 -1 -1 -1 -1 0.201494
1 1 40 128 1 ### 1 5120 1 5120 110 -1 -1 -1 -1 -1 -1 -1 -1 -1 0.080503
1 1 40 128 1 ### 1 13824 1 5120 113 -1 -1 -1 -1 -1 -1 -1 -1 -1 0.188646
1 1 40 128 1 ### 1 5120 1 13824 110 -1 -1 -1 -1 -1 -1 -1 -1 -1 0.192502
1 1 40 128 1 ### 1 7680 1 5120 110 -1 -1 -1 -1 -1 -1 -1 -1 -1 0.116258
1 1 40 128 1 ### 1 5120 1 2560 110 -1 -1 -1 -1 -1 -1 -1 -1 -1 0.048643
1 1 40 128 1 ### 1 6912 1 5120 108 -1 -1 -1 -1 -1 -1 -1 -1 -1 0.106203
1 1 40 128 1 ### 1 5120 1 6912 110 -1 -1 -1 -1 -1 -1 -1 -1 -1 0.104263
1 1 40 128 1 ### 1 3840 1 5120 13 10 0 0 0 0 0 0 0 0 0.057426
1 1 40 128 1 ### 1 5120 1 1280 21 0 11 1 0 0 0 14 0 0 0.027320
1 1 40 128 1 ### 1 3456 1 5120 99 -1 -1 -1 -1 -1 -1 -1 -1 -1 0.051141
1 1 40 128 1 ### 1 5120 1 3456 110 -1 -1 -1 -1 -1 -1 -1 -1 -1 0.059579
2 1 40 128 1 ### 1 15360 2 5120 113 -1 -1 -1 -1 -1 -1 -1 -1 -1 0.202430
2 1 40 128 1 ### 1 5120 2 5120 110 -1 -1 -1 -1 -1 -1 -1 -1 -1 0.080605
2 1 40 128 1 ### 1 13824 2 5120 99 -1 -1 -1 -1 -1 -1 -1 -1 -1 0.180316
2 1 40 128 1 ### 1 5120 2 13824 99 -1 -1 -1 -1 -1 -1 -1 -1 -1 0.182796
2 1 40 128 1 ### 1 7680 2 5120 113 -1 -1 -1 -1 -1 -1 -1 -1 -1 0.116524
2 1 40 128 1 ### 1 5120 2 2560 21 0 11 0 0 0 0 20 0 0 0.045302
2 1 40 128 1 ### 1 6912 2 5120 99 -1 -1 -1 -1 -1 -1 -1 -1 -1 0.100269
2 1 40 128 1 ### 1 5120 2 6912 99 -1 -1 -1 -1 -1 -1 -1 -1 -1 0.102333
2 1 40 128 1 ### 1 3840 2 5120 110 -1 -1 -1 -1 -1 -1 -1 -1 -1 0.067581
2 1 40 128 1 ### 1 5120 2 1280 21 0 11 0 0 0 0 20 0 0 0.025702
2 1 40 128 1 ### 1 3456 2 5120 110 -1 -1 -1 -1 -1 -1 -1 -1 -1 0.061756
2 1 40 128 1 ### 1 5120 2 3456 21 0 11 0 0 0 0 20 0 0 0.058870
3 1 40 128 1 ### 1 15360 3 5120 113 -1 -1 -1 -1 -1 -1 -1 -1 -1 0.204128
3 1 40 128 1 ### 1 5120 3 5120 110 -1 -1 -1 -1 -1 -1 -1 -1 -1 0.080918
3 1 40 128 1 ### 1 13824 3 5120 99 -1 -1 -1 -1 -1 -1 -1 -1 -1 0.180226
3 1 40 128 1 ### 1 5120 3 13824 99 -1 -1 -1 -1 -1 -1 -1 -1 -1 0.183896
3 1 40 128 1 ### 1 7680 3 5120 113 -1 -1 -1 -1 -1 -1 -1 -1 -1 0.117070
3 1 40 128 1 ### 1 5120 3 2560 21 0 11 0 0 0 0 20 0 0 0.045466
3 1 40 128 1 ### 1 6912 3 5120 99 -1 -1 -1 -1 -1 -1 -1 -1 -1 0.100741
3 1 40 128 1 ### 1 5120 3 6912 99 -1 -1 -1 -1 -1 -1 -1 -1 -1 0.102433
3 1 40 128 1 ### 1 3840 3 5120 110 -1 -1 -1 -1 -1 -1 -1 -1 -1 0.067498
3 1 40 128 1 ### 1 5120 3 1280 21 0 11 0 0 0 0 20 0 0 0.025692
3 1 40 128 1 ### 1 3456 3 5120 110 -1 -1 -1 -1 -1 -1 -1 -1 -1 0.061805
3 1 40 128 1 ### 1 5120 3 3456 21 0 11 0 0 0 0 20 0 0 0.059064
4 1 40 128 1 ### 1 15360 4 5120 113 -1 -1 -1 -1 -1 -1 -1 -1 -1 0.204984
4 1 40 128 1 ### 1 5120 4 5120 110 -1 -1 -1 -1 -1 -1 -1 -1 -1 0.081125
4 1 40 128 1 ### 1 13824 4 5120 99 -1 -1 -1 -1 -1 -1 -1 -1 -1 0.180436
4 1 40 128 1 ### 1 5120 4 13824 99 -1 -1 -1 -1 -1 -1 -1 -1 -1 0.184672
4 1 40 128 1 ### 1 7680 4 5120 113 -1 -1 -1 -1 -1 -1 -1 -1 -1 0.117169
4 1 40 128 1 ### 1 5120 4 2560 21 0 11 0 0 0 0 20 0 0 0.045475
4 1 40 128 1 ### 1 6912 4 5120 99 -1 -1 -1 -1 -1 -1 -1 -1 -1 0.102094
4 1 40 128 1 ### 1 5120 4 6912 99 -1 -1 -1 -1 -1 -1 -1 -1 -1 0.103354
4 1 40 128 1 ### 1 3840 4 5120 110 -1 -1 -1 -1 -1 -1 -1 -1 -1 0.067302
4 1 40 128 1 ### 1 5120 4 1280 21 0 11 0 0 0 0 20 0 0 0.025805
4 1 40 128 1 ### 1 3456 4 5120 110 -1 -1 -1 -1 -1 -1 -1 -1 -1 0.061685
4 1 40 128 1 ### 1 5120 4 3456 21 0 11 0 0 0 0 20 0 0 0.059218
